{
  "schema_version": 1,
  "catalog_id": "sturm-windows",
  "name": "Sturm Marketplace",
  "updated_at": "2026-10-30T12:00:00-07:00",
  "apps": [
    {
      "id": "fastcast",
      "name": "FastCast",
      "publisher": "Sturm Technologies LLC",
      "status": "available",
      "version": "0.10.0",
      "summary": "Fast Windows screen recording and streaming built for creators.",
      "homepage_url": "/fastcast",
      "icon_url": "/assets/FastCast/FastCast_Icon.png",
      "release_url": "https://github.com/CalvinSturm/FastCast-releases/releases/tag/v0.10.0",
      "platforms": ["windows-x64"],
      "installer": {
        "kind": "msi",
        "url": "https://github.com/CalvinSturm/FastCast-releases/releases/download/v0.10.0/FastCast-0.10.0-win-x64.msi",
        "sha256": "0b25d656bbd2d37c5a0c8f7433822f7144623e5f62237f1a93a0286e60647c4d",
        "size_bytes": 7438336,
        "signed": false
      },
      "trust": {
        "checksum_published": true,
        "account_required": false,
        "telemetry": "none"
      }
    },
    {
      "id": "fastmedia",
      "name": "FastMedia",
      "publisher": "Sturm Technologies LLC",
      "status": "integration_ready",
      "version": null,
      "summary": "A practical Windows media toolbox for converting, compressing, splitting and previewing media.",
      "homepage_url": null,
      "icon_url": null,
      "release_url": null,
      "platforms": ["windows-x64"],
      "installer": null,
      "trust": {
        "checksum_published": false,
        "account_required": false,
        "telemetry": "unknown"
      },
      "integration_note": "The marketplace entry is wired and ready. A published FastMedia installer URL, version and SHA-256 are still required before downloads can be enabled."
    }
  ]
}
